{
  "$schema": "./packages/spectre-manifest/schema/spectre.manifest.schema.json",
  "$id": "urn:phcdevworks:spectre:manifest:current",
  "schemaVersion": "0.1",
  "system": {
    "name": "Spectre",
    "version": "1.2.0",
    "manifestVersion": "0.1",
    "summary": "Package-level architecture contract for the Spectre ecosystem.",
    "packageManager": "pnpm",
    "notes": [
      "A governance layer keeps manifest, validation, and automation concerns separate from runtime packages."
    ]
  },
  "layers": {
    "foundation": {
      "title": "Foundation",
      "description": "Base design-system packages and adapters that higher layers build on.",
      "order": 10,
      "dependsOn": [],
      "notes": [
        "Foundation packages should remain reusable, framework-light, and safe for broad consumption."
      ]
    },
    "build": {
      "title": "Build",
      "description": "Composition and application-facing packages built on top of the foundation layer.",
      "order": 20,
      "dependsOn": ["foundation"]
    },
    "governance": {
      "title": "Governance",
      "description": "Cross-system tooling and contract packages for validation, scaffolding, CI, docs, and AI workflows.",
      "order": 30,
      "dependsOn": [],
      "notes": [
        "This layer exists so manifest, validation, and automation concerns stay separate from runtime packages."
      ]
    }
  },
  "packages": {
    "@phcdevworks/spectre-tokens": {
      "role": "design-tokens",
      "layer": "foundation",
      "stability": "stable",
      "description": "Design-token source for the Spectre system.",
      "exports": [".", "./index.css"],
      "dependencies": [],
      "consumers": [
        "@phcdevworks/spectre-ui",
        "@phcdevworks/spectre-components",
        "@phcdevworks/spectre-shell",
        "@phcdevworks/spectre-ui-astro",
        "@phcdevworks/spectre-base"
      ],
      "allowedTargets": ["external"]
    },
    "@phcdevworks/spectre-ui": {
      "role": "styling-contract",
      "layer": "foundation",
      "stability": "stable",
      "description": "Layer 2 styling contract between spectre-tokens and downstream adapters or apps.",
      "exports": [".", "./index.css", "./base.css", "./components.css", "./utilities.css"],
      "dependencies": ["@phcdevworks/spectre-tokens"],
      "consumers": [
        "@phcdevworks/spectre-components",
        "@phcdevworks/spectre-shell",
        "@phcdevworks/spectre-ui-astro",
        "@phcdevworks/spectre-base"
      ],
      "allowedTargets": ["package:@phcdevworks/spectre-tokens", "external"]
    },
    "@phcdevworks/spectre-components": {
      "role": "web-components",
      "layer": "build",
      "stability": "beta",
      "description": "Lit-based component layer of the Spectre system for reusable, accessible, framework-agnostic web components.",
      "exports": [
        ".",
        "./input",
        "./button",
        "./textarea",
        "./select",
        "./checkbox",
        "./radio",
        "./label",
        "./fieldset",
        "./badge",
        "./card",
        "./icon-box",
        "./rating",
        "./testimonial",
        "./alert",
        "./avatar",
        "./spinner",
        "./tag",
        "./pricing-card",
        "./container",
        "./grid",
        "./section",
        "./stack",
        "./dropdown",
        "./footer",
        "./footer-chip",
        "./footer-link",
        "./modal",
        "./nav",
        "./nav-item",
        "./sidebar",
        "./sidebar-link",
        "./sidebar-toggle",
        "./toast",
        "./tooltip",
        "./text",
        "./tabs",
        "./tab-panel",
        "./accordion",
        "./accordion-item",
        "./breadcrumb",
        "./list-group",
        "./list-group-item",
        "./offcanvas",
        "./carousel",
        "./table",
        "./pagination",
        "./stepper",
        "./card-bleed",
        "./prose",
        "./progress",
        "./switch",
        "./range",
        "./file-input",
        "./external-auth-button",
        "./choice-card",
        "./input-group",
        "./popover",
        "./datepicker",
        "./logo-cloud",
        "./skeleton",
        "./quote",
        "./stat",
        "./section-head"
      ],
      "dependencies": ["@phcdevworks/spectre-tokens", "@phcdevworks/spectre-ui"],
      "consumers": ["@phcdevworks/spectre-base"],
      "allowedTargets": ["layer:foundation", "external"]
    },
    "@phcdevworks/spectre-ui-astro": {
      "role": "astro-adapter",
      "layer": "build",
      "stability": "stable",
      "description": "Astro adapter for the Spectre system for Astro applications that consume the core Spectre UI contract.",
      "exports": [
        ".",
        "./components/SpAccordion.astro",
        "./components/SpAccordionItem.astro",
        "./components/SpAlert.astro",
        "./components/SpAvatar.astro",
        "./components/SpBadge.astro",
        "./components/SpBreadcrumb.astro",
        "./components/SpButton.astro",
        "./components/SpCard.astro",
        "./components/SpCardBleed.astro",
        "./components/SpCarousel.astro",
        "./components/SpCarouselIndicator.astro",
        "./components/SpCarouselSlide.astro",
        "./components/SpCheckbox.astro",
        "./components/SpChoiceCard.astro",
        "./components/SpContainer.astro",
        "./components/SpDatepicker.astro",
        "./components/SpDay.astro",
        "./components/SpDisplay.astro",
        "./components/SpDropdown.astro",
        "./components/SpDropdownDivider.astro",
        "./components/SpDropdownHeader.astro",
        "./components/SpDropdownItem.astro",
        "./components/SpDropdownMenu.astro",
        "./components/SpExternalAuthButton.astro",
        "./components/SpFieldset.astro",
        "./components/SpFileInput.astro",
        "./components/SpFooter.astro",
        "./components/SpFooterChip.astro",
        "./components/SpFooterDivider.astro",
        "./components/SpFooterHeading.astro",
        "./components/SpFooterLink.astro",
        "./components/SpFooterLinks.astro",
        "./components/SpFooterText.astro",
        "./components/SpGrid.astro",
        "./components/SpHeading.astro",
        "./components/SpIconBox.astro",
        "./components/SpInput.astro",
        "./components/SpInputGroup.astro",
        "./components/SpInputGroupAddon.astro",
        "./components/SpLabel.astro",
        "./components/SpLead.astro",
        "./components/SpListGroup.astro",
        "./components/SpListGroupItem.astro",
        "./components/SpLogoCloud.astro",
        "./components/SpLogoCloudItem.astro",
        "./components/SpModal.astro",
        "./components/SpNav.astro",
        "./components/SpNavItem.astro",
        "./components/SpNavLinks.astro",
        "./components/SpOffcanvas.astro",
        "./components/SpPagination.astro",
        "./components/SpPopover.astro",
        "./components/SpPricingCard.astro",
        "./components/SpProgress.astro",
        "./components/SpProse.astro",
        "./components/SpQuote.astro",
        "./components/SpRadio.astro",
        "./components/SpRange.astro",
        "./components/SpRating.astro",
        "./components/SpSection.astro",
        "./components/SpSectionHead.astro",
        "./components/SpSelect.astro",
        "./components/SpSidebar.astro",
        "./components/SpSidebarGroup.astro",
        "./components/SpSidebarHeader.astro",
        "./components/SpSidebarLink.astro",
        "./components/SpSidebarToggle.astro",
        "./components/SpSkeleton.astro",
        "./components/SpSpinner.astro",
        "./components/SpStack.astro",
        "./components/SpStat.astro",
        "./components/SpStepper.astro",
        "./components/SpSwitch.astro",
        "./components/SpTabPanel.astro",
        "./components/SpTable.astro",
        "./components/SpTableRow.astro",
        "./components/SpTabs.astro",
        "./components/SpTag.astro",
        "./components/SpTestimonial.astro",
        "./components/SpText.astro",
        "./components/SpTextarea.astro",
        "./components/SpToast.astro",
        "./components/SpTooltip.astro"
      ],
      "dependencies": ["@phcdevworks/spectre-tokens", "@phcdevworks/spectre-ui"],
      "consumers": [],
      "allowedTargets": ["layer:foundation", "external"]
    },
    "@phcdevworks/spectre-shell-router": {
      "role": "shell-routing",
      "layer": "build",
      "stability": "beta",
      "description": "Minimal, framework-agnostic client-side router for Spectre-based applications.",
      "exports": ["."],
      "dependencies": [],
      "consumers": ["@phcdevworks/spectre-shell"],
      "allowedTargets": ["external"]
    },
    "@phcdevworks/spectre-shell-signals": {
      "role": "shell-state-signals",
      "layer": "build",
      "stability": "beta",
      "description": "Minimal, framework-agnostic reactive primitives package for Spectre applications.",
      "exports": ["."],
      "dependencies": [],
      "consumers": ["@phcdevworks/spectre-shell"],
      "allowedTargets": ["external"]
    },
    "@phcdevworks/spectre-shell": {
      "role": "application-shell",
      "layer": "build",
      "stability": "beta",
      "description": "Thin, framework-agnostic bootstrap shell for Spectre apps.",
      "exports": ["."],
      "dependencies": [
        "@phcdevworks/spectre-shell-router",
        "@phcdevworks/spectre-shell-signals",
        "@phcdevworks/spectre-tokens",
        "@phcdevworks/spectre-ui"
      ],
      "consumers": [],
      "allowedTargets": [
        "layer:foundation",
        "package:@phcdevworks/spectre-shell-router",
        "package:@phcdevworks/spectre-shell-signals",
        "external"
      ]
    },
    "@phcdevworks/spectre-base": {
      "role": "wordpress-theme-foundation",
      "layer": "build",
      "stability": "experimental",